{
  "schemaVersion": 1,
  "gameBuild": "25677108",
  "units": "meters",
  "projectiles": [
    {
      "id": "Item.Caliber.120x570mm",
      "asset": "Content/GameMechanics/Inventory/Equipment/Caliber/120x570mm/DA_120x570mm_ProjectileData",
      "damage": 150,
      "damageType": "Meta.Damage.Explosive.Rocket.120mm",
      "damageContext": [],
      "massKg": 20,
      "diameterMm": 120,
      "lengthMm": 570,
      "drag": {
        "coefficient": 10,
        "model": "GC (Cylinder)"
      },
      "typicalSpeed": 224,
      "penetration": {
        "penetrates": false,
        "ricochetMinAngle": 91
      },
      "explosive": {
        "radius": 7.5,
        "effectiveRadius": 4.2,
        "falloff": 0.3,
        "minimumDamage": 30,
        "bluntDamage": 150
      },
      "suppression": 1,
      "propulsion": {
        "thrustSpeed": 220
      },
      "items": [
        "ID.Item.120x570mm"
      ]
    },
    {
      "id": "Item.Caliber.120x800mm.Standard",
      "asset": "Content/GameMechanics/Inventory/Equipment/Caliber/120x800mm/DA_120x800mm_Standard_ProjectileData",
      "damage": 120,
      "damageType": "Meta.Damage.Explosive.Rocket.120x800mm",
      "damageContext": [],
      "massKg": 15,
      "diameterMm": 120,
      "lengthMm": 80,
      "drag": {
        "coefficient": 11.5,
        "model": "GC (Cylinder)"
      },
      "typicalSpeed": 150,
      "penetration": {
        "penetrates": false,
        "ricochetMinAngle": 91
      },
      "explosive": {
        "radius": 10,
        "effectiveRadius": 5,
        "falloff": 0.45,
        "minimumDamage": 15,
        "bluntDamage": 120
      },
      "suppression": 0.8,
      "propulsion": {
        "thrustSpeed": 220
      },
      "items": [
        "Id.Item.120x800mm"
      ]
    },
    {
      "id": "Item.Caliber.122mm",
      "asset": "Content/GameMechanics/Inventory/Equipment/Caliber/122mm/DA_122mm_ProjectileData",
      "damage": 100,
      "damageType": "Meta.Damage.Explosive.Rocket.122mm",
      "damageContext": [],
      "massKg": 57,
      "diameterMm": 122,
      "lengthMm": 2540,
      "drag": {
        "model": "GC (Cylinder)"
      },
      "typicalSpeed": 1430,
      "penetration": {
        "penetrates": false,
        "penetratesThinSurfaces": true,
        "effectivenessMultiplier": 2,
        "ricochetMinAngle": 91
      },
      "explosive": {
        "radius": 6,
        "effectiveRadius": 2,
        "falloff": 1,
        "minimumDamage": 10,
        "bluntDamage": 50
      },
      "suppression": 0.6,
      "propulsion": {
        "thrustSpeed": 200
      },
      "items": [
        "Id.Item.122mm"
      ]
    },
    {
      "id": "Item.Caliber.122mm.Havoc",
      "asset": "Content/GameMechanics/Inventory/Equipment/Caliber/122mm/DA_122_mm_HAVOC_ProjectileData",
      "damage": 300,
      "damageType": "Meta.Damage.Explosive.Rocket.122mm",
      "damageContext": [],
      "massKg": 57,
      "diameterMm": 122,
      "lengthMm": 2540,
      "drag": {
        "model": "GC (Cylinder)"
      },
      "typicalSpeed": 1430,
      "penetration": {
        "penetrates": false,
        "penetratesThinSurfaces": true,
        "effectivenessMultiplier": 2,
        "ricochetMinAngle": 91
      },
      "explosive": {
        "radius": 3,
        "effectiveRadius": 6,
        "falloff": 0.6
      },
      "suppression": 1,
      "propulsion": {
        "thrustSpeed": 200
      },
      "items": []
    },
    {
      "id": "Item.Caliber.12g.RifledSlug",
      "asset": "Content/GameMechanics/Inventory/Equipment/Caliber/7mm_Buckshot/DA_12g_RifledSlug_ProjectileData",
      "damage": 105,
      "damageType": "Meta.Damage.Bullet.12g.RifledSlug",
      "damageContext": [
        "Meta.Damage.Arms.Small"
      ],
      "massKg": 0.028,
      "diameterMm": 18.5,
      "lengthMm": 30,
      "drag": {
        "model": "GL (Blunt Nose)"
      },
      "typicalSpeed": 298,
      "penetration": {
        "exitSpeedMultiplier": 0.12
      },
      "suppression": 0.5,
      "items": [
        "Id.Item.12g.RifledSlug"
      ]
    },
    {
      "id": "Item.Caliber.155mm.Expensive",
      "asset": "Content/GameMechanics/Inventory/Equipment/Caliber/155mm/DA_155mm_Expensive_ProjectileData",
      "damage": 450,
      "damageType": "Meta.Damage.Explosive.Rocket.155mm",
      "damageContext": [],
      "massKg": 19,
      "diameterMm": 105,
      "lengthMm": 400,
      "drag": {
        "coefficient": 2.5,
        "model": "GC (Cylinder)"
      },
      "typicalSpeed": 150,
      "penetration": {
        "penetrates": false,
        "ricochetMinAngle": 91
      },
      "explosive": {
        "radius": 20,
        "effectiveRadius": 10,
        "falloff": 0.93,
        "bluntDamage": 100
      },
      "suppression": 0.8,
      "propulsion": {
        "thrustSpeed": 220
      },
      "items": [
        "ID.Item.155mm.Expensive"
      ]
    },
    {
      "id": "Item.Caliber.155mm.Expensive.Sandbox",
      "asset": "Content/GameMechanics/Inventory/Equipment/Caliber/155mm/DA_155mm_Expensive_ProjectileData_SB",
      "damage": 450,
      "damageType": "Meta.Damage.Explosive.Rocket.155mm",
      "damageContext": [],
      "massKg": 70,
      "diameterMm": 84,
      "lengthMm": 254,
      "drag": {
        "coefficient": 80,
        "model": "GC (Cylinder)"
      },
      "typicalSpeed": 150,
      "penetration": {
        "penetrates": false,
        "ricochetMinAngle": 91
      },
      "explosive": {
        "radius": 20,
        "effectiveRadius": 7.5,
        "falloff": 0.5
      },
      "suppression": 0.8,
      "propulsion": {
        "thrustSpeed": 220
      },
      "items": [
        "ID.Item.155mm.Expensive.Sandbox"
      ]
    },
    {
      "id": "Item.Caliber.155mm.Standard",
      "asset": "Content/GameMechanics/Inventory/Equipment/Caliber/155mm/DA_155mm_Standard_ProjectileData",
      "damage": 450,
      "damageType": "Meta.Damage.Explosive.Rocket.155mm",
      "damageContext": [],
      "massKg": 70,
      "diameterMm": 84,
      "lengthMm": 254,
      "drag": {
        "coefficient": 80,
        "model": "GC (Cylinder)"
      },
      "typicalSpeed": 150,
      "penetration": {
        "penetrates": false,
        "ricochetMinAngle": 91
      },
      "explosive": {
        "radius": 20,
        "effectiveRadius": 7.5,
        "falloff": 0.5
      },
      "suppression": 0.8,
      "propulsion": {
        "thrustSpeed": 220
      },
      "items": [
        "ID.Item.155mm",
        "ID.Item.155mm.Standard"
      ]
    },
    {
      "id": "Item.Caliber.155mm.Standard.Sandbox",
      "asset": "Content/GameMechanics/Inventory/Equipment/Caliber/155mm/DA_155mm_Standard_ProjectileData_SB",
      "damage": 450,
      "damageType": "Meta.Damage.Explosive.Rocket.155mm",
      "damageContext": [],
      "massKg": 70,
      "diameterMm": 84,
      "lengthMm": 254,
      "drag": {
        "coefficient": 80,
        "model": "GC (Cylinder)"
      },
      "typicalSpeed": 150,
      "penetration": {
        "penetrates": false,
        "ricochetMinAngle": 91
      },
      "explosive": {
        "radius": 20,
        "effectiveRadius": 7.5,
        "falloff": 0.5
      },
      "suppression": 0.8,
      "propulsion": {
        "thrustSpeed": 220
      },
      "items": [
        "ID.Item.155mm.Sandbox",
        "ID.Item.155mm.Standard.Sandbox"
      ]
    },
    {
      "id": "Item.Caliber.20x102mm",
      "asset": "Content/GameMechanics/Inventory/Equipment/Caliber/20x102mm/DA_20x102mm",
      "damage": 60,
      "damageType": "Meta.Damage.Cannon.20x102mm",
      "damageContext": [],
      "massKg": 0.04,
      "diameterMm": 10,
      "lengthMm": 99,
      "drag": {
        "model": "G7 (Boat Tail)"
      },
      "typicalSpeed": 224,
      "penetration": {
        "effectivenessMultiplier": 1.8,
        "ricochetMinAngle": 91
      },
      "explosive": {
        "effectiveRadius": 3.75,
        "falloff": 0.7
      },
      "suppression": 0.55,
      "propulsion": {
        "thrustSpeed": 220
      },
      "items": [
        "Id.Item.20x102mm"
      ]
    },
    {
      "id": "Item.Caliber.308Win",
      "asset": "Content/GameMechanics/Inventory/Equipment/Caliber/308Winchester/DA_308Winchester_ProjectileData",
      "damage": 60,
      "damageType": "Meta.Damage.Bullet.308Win",
      "damageContext": [
        "Meta.Damage.Arms.High"
      ],
      "massKg": 0.012,
      "diameterMm": 7.82,
      "lengthMm": 32,
      "drag": {
        "coefficient": 0.9,
        "model": "G7 (Boat Tail)"
      },
      "typicalSpeed": 385,
      "penetration": {
        "exitSpeedMultiplier": 0.13
      },
      "suppression": 0.9,
      "items": [
        "Id.Item.308Win",
        "Id.Item.308Win.ArmorPiercing",
        "Id.Item.308Win.ArmorPiercing.Tracer",
        "Id.Item.308Win.HollowPoint",
        "Id.Item.308Win.HollowPoint.Tracer",
        "Id.Item.308Win.Tracer"
      ]
    },
    {
      "id": "Item.Caliber.30mm",
      "asset": "Content/GameMechanics/Inventory/Equipment/Caliber/30mm/DA_30mm_ProjectileData",
      "damage": 100,
      "damageType": "Meta.Damage.Cannon.30mm",
      "damageContext": [
        "Meta.Damage.Arms.High"
      ],
      "massKg": 0.22,
      "diameterMm": 30,
      "lengthMm": 290,
      "drag": {
        "coefficient": 2,
        "model": "GC (Cylinder)"
      },
      "typicalSpeed": 800,
      "penetration": {
        "effectivenessMultiplier": 2,
        "ricochetMinAngle": 85
      },
      "explosive": {
        "radius": 3,
        "effectiveRadius": 1,
        "falloff": 1,
        "minimumDamage": 20
      },
      "suppression": 0.55,
      "propulsion": {
        "thrustSpeed": 200
      },
      "items": [
        "Id.Item.30mm"
      ]
    },
    {
      "id": "Item.Caliber.338Nor",
      "asset": "Content/GameMechanics/Inventory/Equipment/Caliber/338NormanMagnum/DA_338Norman_ProjectileData",
      "damage": 105,
      "damageType": "Meta.Damage.Bullet.338Nor",
      "damageContext": [